{
  "siteTitle": "Hamac & Co.",
  "items": [
    {
      "label": "Home / Accueil",
      "href": "/"
    },
    {
      "label": "Collection",
      "href": "/services"
    },
    {
      "label": "About / À propos",
      "href": "/about"
    },
    {
      "label": "FAQ",
      "href": "/faqs"
    },
    {
      "label": "Contact",
      "href": "/contact"
    }
  ],
  "cta": {
    "label": "Shop Now / Acheter",
    "href": "/services"
  },
  "footer": {
    "copyrightText": "© 2025 Hamac & Co. All rights reserved. / Tous droits réservés.",
    "tagline": "Premium hammocks for European outdoor living. / Hamacs de qualité pour la vie en plein air en Europe.",
    "columns": [
      {
        "heading": "Company / Entreprise",
        "links": [
          {
            "label": "About us / À propos",
            "href": "/about"
          },
          {
            "label": "Our story / Notre histoire",
            "href": "/about"
          },
          {
            "label": "Collection",
            "href": "/services"
          }
        ]
      },
      {
        "heading": "Help / Aide",
        "links": [
          {
            "label": "Contact",
            "href": "/contact"
          },
          {
            "label": "FAQ",
            "href": "/faqs"
          },
          {
            "label": "Shipping / Livraison",
            "href": "/faqs"
          }
        ]
      },
      {
        "heading": "Connect / Nous suivre",
        "links": [
          {
            "label": "Instagram",
            "href": "https://instagram.com"
          },
          {
            "label": "Email",
            "href": "mailto:hello@hamacandco.eu"
          }
        ]
      }
    ]
  }
}
